headline	text	category	url
PDP presidential primary 2022 winner results: Atiku win	"Atiku Abubakar don emerge presidential candidate of Peoples Democratic Party [PDP] for 2023 general election. PDP wey be Nigeria main opposition party vote on Saturday May 28 to choose di best candidate wey go be di presidential flag bearer of di party. Di Presidential Primary 2022 na part of preparation for di next year election. Na 13 aspirants, as at Saturday morning, dey contest to be di presidential candidate of di party. Former Vice President of Nigeria, Atiku Abubakar get 371 votes. Govnor of Rivers state Nyesom Wike record 237 votes Former Senate President, Bukola Saraki pull 70 votes Akwa Ibom State Governor, Emmanuel Udom score 38 votes Bauchi State Govnor, Bala Mohammed get 20 votes Former Senate President/SSG, Pius Anyim collect 14 votes Tambuwal step down from PDP presidential race for Atiku Pharmacist, Sam Ohabunwa take 1 vote Female aspirant, Olivia Tariela take 1 vote Publisher, Dele Momodu score 0 Former governor of Ekiti State, Ayo Fayose score 0 Lawyer, Charles Okwudili get 0 Few days earlier, a strong aspirant and former governor of Anambra state, Peter Obi resign from di party on Wednesday. Then on di morning of di presidential primaries, anoda aspirant Mohammad Hayat-Deen withdraw from di race. Hayat-Deen drop dis one for letter wey im address to di PDP chairman, Iyiochia Ayu on May 27, 2022. Oga Hayat-deen tok say di exercise dey obscenely monetized"", and e go against im personal principles, among oda reasons. Di party say dem don ready kampe to successfully do dia special convention and elect a presidential candidate. Di move meet di June 3 deadline wey INEC first give for all parties in di kontri to submit di names of dia candidates. I7 aspirants bin start di journey to run for di highest office for Nigeria but a few of dem no make am pass di screening stage. Na only 15 aspirants qualify to run for di platform of di party, but Peter Obi resign im PDP membership, leaving just 14. According to di PDP tok-tok pesin, Debo Olugunagba say di party dey use indirect primaries to pick di party presidential flag bearer. And dat na only elected delegates wey be one pesin per local goment plus di three ad hoc delegates from di ward congresses go vote. PDP Presidential Primary 2022 go hold for di Abuja National Stadium. For di last few months, Nigeria political space dey coloured wit plenti political activities. Different aspirants on di platform of di opposition party dey criss-cross di kontri to woo delegates to vote for dem. Dia campaign promises dey loud as dem visit di delegates dem. And some promise dem say dem go tackle di issue of security, economy, and education and oda sector of di economy. Di mix of di aspirants cut across di different geo-political zones of di kontri and thanks to di party throway di zoning arrangement. Di party publicity director, Chinwe Nnorom say di party decide not zone in order to democraticise di process to reflect popular demand. Sake of dis, some of di aspirants don form coalition to out do demselves as dem use last minute to lobby di delegates. Last minute horse trading and politicking dey also go on for different quarters for di kapital. Dis year national convention to elect dia presidential candidate But dis year, dem go doa am for Velodrome for di national stadium. According to one PDP tofficial, e say e no be di plan of di party to choose di stadium. But dat wen dem apply to FCT to use di Eagle Square, di authority turn dem down. Na sake of say dem gatz secure di place for 24 hours since di president go attend di ruling APC presidential primaries on 29 May. Na about 810 delegates go vote during dis special national convention to elect a presidential candidate. Dis delegate go cast dia vote for dia preferred appriants. Dem go issue di delegates ballot paper wit di names of di aspirants and den, dem go tick di one dem like Di candidate wit di highest vote go win di primary and dem go declare am as di party presidential flag bearer. Delegate election dey very unpredictable sake of say dis delegates fit change dia mind anytime and e no dey clear who dem go vote. According to PDP tok tok pesin, statutory delegates like govnors dem and oda principal officers no go vote. Even say National Assembly don okay make dis statutory delegates vote but di Nigerian president neva sign am to law. And so di PDP no go use statutory delegates to elect dia presidential candidates. Di FCT Police Command don deploy large number of police officers for di venue of di PDP convention. Di command for statement say sake of di convention, dem go deploy security also across di capital to ensure di protection of lives and property Di police took tok pesin, Josephine Adeh for statement say dem go put counter insurgency measure, dem go do robust stop and search for strategic point around di suburbs and those on di ground, go control di crowd dem. According to political sabi pipo wey yarn wit BBC Pidgin, di first task for any pesin wey emerge as di party candidate na to unify di party. Through di electioneering process, di party structure dey divided along several lines wey fit affect dia success ahead of di election. Political analysts claim say if di candidate no pull everibodi togeda, di party no go go far. Anoda issue wey fit affect di candidate na finance, since di PDP leave power, moni to run di party and drive campaign na big case. Di candidate gatz get moni and unite party pipo togeda to fund dia campaign if not, moni fit serve as barrier to di candidate. also di larger scene, Nigeria for years now don dey face plenti security and economic wahala, di candate also gatz try fix those wahala if di person want nigerians to support am. Di need to also fix di power sector go be anoda major area to focus on if di candidate wan make di kontri beta."	NIGERIA	https://www.bbc.com/pidgin/tori-61598228
Stampede in Port Harcourt: Governor Wike order probe into incident wey kill 31 for Kings Assembly special charity programme	"Rivers state goment don order probe panel to investigate wetin cause di stampede for Polo Club Port Harcourt, Rivers state for Southern Nigeria wey cause di deaths of many pipo. Govnor Nyesom Wike through im media aide, Kelvin Ebiri tell sorry to families wey loose dia pesin and those wey dey injured for di incident. Di incident happun for Kings Assembly church charity programme 'Shop for Free' wey dem dey do to share food and oda tins. Rivers State Police Command tok tok pesin DSP Grace Iringe-Koko confam di tori to BBC Pidgin, she say 31 pesins die for di stampede. BBC Pidgin gada from eye witnesses say di programme suppose start by 9am on Saturday but plenti pipo begin gada since Friday evening dey wait for di venue of di event and by early morning 6am dem rush inside wen some pipo wey dey do sports for di open di small gate wey come result to stampede. Dem don deposit some of di deadibody for Military mortuary while those wey dey injured dey received treatment. Dis edition of di 'Shop for Free' programme of The Kings Assembly suppose be di fourth one. Di programme na outreach of di church wey dey give out free food and oda tins wey pipo need like clothes, shoes, household items as well as free medical checks and sharing di gospel. The Kings Assembly, di church wey organise di programme say dem dey work with di Police authorities to find out wetin really cause di stampede. For statement wey di Director of Administration, Chimeka Elem sign, dem say dem dey sad about di unfortunate incident wey happun for di programme wey dem intend to help and share gifts to di less privileged. E explain say di 'Shop for Free' programme start for 2014 and dem dey always take safety of dia congregation seriously, but for dis year own, dem choose di Polo Club sake of di large crowd dem expect but dem no expect wetin happun because di crowd gada overnight long before di security teams dem get for di event take dia place. Elem say dia medical team and volunteers dey work with personnel of di Military Hospital to treat those wey dey injured even as dem dey review dia Public safety protocol and advance crowd management procedures to make sure say dia events go dey safe. E add say any further details of developments dem go share with di public even as dem dey trace and engage with families wey dey affected. One eye witness wey see as e happen korokoro say she don benefit from di ""Shop for free' outreach programme wen di church, The Kings Assembly organise last year for dia church premises. She say she hear announcement of di programme for radio na im make she come to come benefit too but wen she come she see a huge crowd of pipo. ""I come here as early as 5am but pipo don full evriwia dey wait. Di crowd full and dem dey tell di gatemen dem to open di gate but dem no gree. Around dat 6am na im dem come open di small gate wey make pipo to push as dem dey rush enter so pipo come fall and anoda peson fall unto anoda pesin na so do stampede happen."" She tok. She say some victims die on di spot while di church call ambulance wey odas go di nearby Military hospital and some dey critical condition. "	NIGERIA	https://www.bbc.com/pidgin/world-61614803
Delegate meaning: Who be Party delegates and how dem dey pick dem?	"Dis period na wen political party delegates dey shine sake of dia importance in electing candidates wey go represent dia party for di 2023 general elections. In di build-up to di primaries and convention of di two main political parties for Nigeria, di Peoples' Democratic Parties, PDP, di All Progressives Congress, reports of how aspirants meet wit delegates to seek dia support for di process full ground. Di new Electoral Act allow political parties to adopt different ways to elect dia flagbearers - Direct, indirect and consensus mode of primaries. Experts including Inec advise parties to adopt consensus mode to avoid wahala. Di two main parties meanwhile, decide to use indirect primary wey allow delegates to vote for primaries. Section 84 (8) of di act say ""A political party wey adopt di system of indirect primaries for di choice of dia candidate go clearly outline dia constitution and rules di procedure for di democratic election of delegates to vote for di convention, congress or meeting."" Sake of say di parties dem decide to adopt indirect primaries wey leave am for delegates to vote for di just concluded primaries, dia role and importance for di electoral process come up and questions like who dem be, and wetin dia role be come up. Jikume Bethlehem wey be PDP ward delegate tell BBC Pidgin say party delegates na registered members of di party wey oda members elect so dem go fit cast dia votes for aspirants during primary elections. Na pesin wey get highest number of votes for di primary election go represent di party for different elective positions. According to di politician, di same pesin no fit be delegate twice except dem elect am again ahead of anoda general elections. ""Becos you be delegate today no mean say you go be delegate tomorrow except say dem elect you again. Dis na sake of say na democratic process whereby party members elect who go vote dia own candidate,"" di politician tok. Bethlehem say na different delegates dey and dem include ward delegate and national delegates. Delegates na card carrying members of parties and dem dey emerge through election for dia parties. Barrister Maliki Quliya wey be PDP national delegate also shook mouth for di mata. ""Delegates na party members wey oda party members elect through democratic process to represent dem to choose who go fly di flag of di party, "" Barrister Quliya tok. Im tok say each national delegate come from di 774 local goment of Nigeria. Na dis delegate dey elect party presidential candidate. Meanwhile, Madam Bethlehem say na three pipo per ward across di kontri dey emerge as ward delegates and one pesin per local goment across di kontri dey emerge as national delegates. Di ward delegates na dem dey vote candidates for di House of Assembly, House of Representatives, Senate and governorship. But di national delegates dem dey vote presidential candidate. Di zonal vice chairman of PDP Kano North, Hashimu Sulaiman, tell BBC Pidgin say for national delegate, im party get two or three pipo from each local goment wey go seek election as delegate and only one of dem go emerge to represent dia local goment. ""We call for congresses and dey elect one from each local goment,"" Sulaiman tok. E say na 44 national delegates Kano produce sake of say na 44 local goments di state get, and all di delegates go Abuja for di PDP primaries. Sulaiman also shook mouth ontop tori wey dey circulate ontop social media about delegates wey collect money before primaries. E tok say some of di tori dey true and some na fake news. Sulaiman tok say delegates dey organised for Kano and dem get leadership, and na dat leadership go decide who dem go vote. On Saturday, di PDP delegates wey party members elect from local goment across di kontri vote Atiku Abubakar as dia presidential candidate for di 2023 general elections. Na 13 aspirants, contest to be di presidential candidate of di party. Former Vice President of Nigeria, Atiku Abubakar get 371 votes. Govnor of Rivers state Nyesom Wike record 237 votes Former Senate President, Bukola Saraki pull 70 votes Akwa Ibom State Governor, Emmanuel Udom score 38 votes Bauchi State Govnor, Bala Mohammed get 20 votes Former Senate President/SSG, Pius Anyim collect 14 votes Tambuwal step down from PDP presidential race for Atiku Pharmacist, Sam Ohabunwa take 1 vote Female aspirant, Olivia Tariela take 1 vote Publisher, Dele Momodu score 0 Former governor of Ekiti State, Ayo Fayose score 0 Lawyer, Charles Okwudili get 0"	NIGERIA	https://www.bbc.com/pidgin/tori-61630252
Asup strike update: Polytechnic lecturers go resume May 30th - See wetin fit happun next	Di National President of Academic Staff Union of Polytechnic, ASUP, Dr. Anderson Ezeibe say polytechnic lecturers go resume work on Monday May 30. Oga Anderson tell BBC Pidgin say di resumption na sake of say dia two-week strike don end today. Mr Ezeibe confam say goment don meet four out of dia demands during di two weeks wey dem dey strike. Goment don dey pay dem dia minimum wage arrears wey dem owe polytechnic lecturers and dey also act on di provisions of di Federal Polytechnics Act wey dem amend for 2019. Mr Ezeibe also say di issue of victimisation of some Union Officers wey chop sack don also dey addressed. On wetin go happun next, e say wen dem resume, di National Executive Council go meet for June to do tok-tok on wetin dey next. Di Academic Staff Union of Polytechnics bin start dia warning strike on di 16th of May, 2022 to last till on di 30th of May, 2022. Ezeibe wey announce di strike den say di union lock up di polytechnics to demand dia revitalization funds wey goment promise dem but neva pay shi shi, renegotiate dia condition of service and also di issue of dia minimum wage. Di Academic Staff Union of Polytechnics bin go strike sake to press home dia demands wey include issue around non release of di 15 billion revitalization fund for di sector 11 months afta President Muhammadu Buhari give approval. Odas na: Meanwhile, di Academic Staff Union Of Universities, ASUU still dey on strike. Nigeria Minister of Labour, Employment and Productivity Chris Ngige for im meeting wit ASUU and oda university-based unions for May, beg dem to suspend dia strike. Minister Chris Ngige make di appeal as e yarn tori pipo for Abuja di Nigerian capital on top di lingering strike. E say goment don begin pay di areas of minimum wage of university and polytechnic lecturers dem across di kontri. Universities don dey under lock and key since February 14. Di striking lecturers go strike on top dia revitalization moni, dia welfare and di implementation of dia 2009 agreement wit goment. Ngige say goment go spend 34 billion naira on top di minimum wage areas moni wey dem go begin pay lecturers for universities and polytechnics.	NIGERIA	https://www.bbc.com/pidgin/tori-61623359
Telecoms tax: Nigeria new tax on phone calls explainer	"Nigerians go soon begin pay ""telecoms tax"", dis na tax on top phone calls wey pipo dey make. Di telecommunications tax dey inside di National Health Insurance bill 2021 wey don become law. President Muhammadu Buhari just sign am into Law last week. Nigerian Communications Commission tell BBC Pidgin say dem still dey torchlight di Law. So how e go affect you? Na di full explanation dey inside dis tori. Di tax na part of goment way to raise money to fund di health insurance scheme of di kontri. Di money wey go come out from di deductions dey go di Vulnerable Group Fund, as part of health care reforms. Vulnerable Group Fund be money wey Buhari goment set up for Nigerians wey dey weak and helpless alias poor. Na under Section 26 subsection 1 (C) of di act di provision dey - e say goment go take one kobo per second of evri telephone call. Dis mean say, for example, if your telephone service provider dey charge 11kobo per second, evri one kobo na charge for health care levy. ""Di source of money for di Vulnerable group fund include basic health care provision to di authority, health insurance levy... ""...telecommunications tax, not less dan one kobo per second of GSM calls."" di act tok for wetin BBC Pidgin don see. E neva clear if di Law don already take effect as president Buhari don sign am. Nigerians also neva begin tok weda dem don dey see di effect of di deductions for dia telephone calls. Ikechukwu Adile, NCC Head of Corporate Affairs say di agency still dey study di di new act wey dey dia table. ""We still dey look di Law and we go make statement to Nigerians wen we dey ready,"" e tok. Tax on telephone calls go affect mostly poor Nigerians wey dey struggle already, na so one sabi pesin tok. Hamzat Lawal, founder of Follow the money, say citizens no dey feel di impact of di oda taxes wey dem dey pay since. E say: ""No tax dey healthy or unhealthy because e dey help citizens support goment to build public-use infrastructure."" ""As well as transform different sectors like health and education."" Lawal also say Nigerians no dey benefit from di tax dem dey pay already. ""Reports say teleco operators dey complain about di policy wey mandate citizens to pay extra 5% on phone calls go make tins harder on citizens. ""Wit di current devaluation of di naira and inflation, pesin fit argue say na bad timing to further burden di population"" ""Especially wen little or no tangible results dey for all taxes citizens dey pay."" Hamzat Lawal say as long as paying tax no contribute to community needs, every citizen, including less privileged go dey seriously affected."	NIGERIA	https://www.bbc.com/pidgin/tori-61576453
PDP Presidential Primaries 2022: Atiku Abubakar get Peoples Democratic Party ticket but e go fit win di 2023 elections?	"Former Nigeria Vice President Atiku Abubakar don win di main opposition party of Nigeria, Di Peoples Democratic Party, PDP, dia presidential ticket to represent di party for di 2023 elections. Atiku get 371 votes to defeat di oda aspirants dem and im closest challenger, Govnor of Rivers state, Nyesom Wike wey get 237 votes. Atiku for im acceptance speech say im go make sure say unity dey for Nigeria and give all citizens sense of belonging irrespective of wia dem come from or di religion dem dey practice. E also tok say im go deal decisively wit di kontri security, economic challenge wey dey face di kontri. Meanwhile di APC national leader and presidential aspirant Bola Tinubu don congratulate Atiku on im victory. For im own message say: ""I welcome di victory of Alhaji Atiku Abubakar as di candidate of di Peoples Democratic Party for di just concluded primary. I look forward to square up wit am as one worthy opponent for di coming election, e add for statement. Ogbonge Nigerians don dey drop dia congratulations for Atiku Abubakar domot. Govnor Duoye Diri of Bayelsa state for im facebook page say, ""I congratulate Alhaji Atiku Abubakar on im emergence as presidential flag bearer of our party PDP, afta our succesful primaries"". Also Governor Godwin Obaseki for inside statement, say ""I heartily congratulate his Excellency, Atiku Abubakar (GCON) on im victory for di Peoples Democratic Party Presidential primary election. E add say, ""di keenly contested process of picking flagbearer for our great party don again show say PDP as party wey don enthrone one transparent internal democratic process be wetin our nation now desperately need for im much -desired rebirth"". Atiku Abubakar no be visitor for di contest for Nigeria president. seat as im don try im luck five times before now but e no win. But recently for one interview, di former vice president wey bin serve wit Former President Olusegun Obasanjo dat time say im get hope say e go win di presidential race come 2023. Di reason wey im give be say e bin contest Adamawa governor seat four times bifo im win di fourth time. For 1993, e bin contest for di Social Democratic Party presidential primaries and lost to Moshood Abiola and Baba Gana Kingibe. Oga Atiku be contest for president under Action Congress for 2007 wia e lost to Umaru Yar'Adua of PDP . For 2011 oga Atiku bin contest di presidential election wit former President Goodluck Jonathan but e loose. For 2014, e join di All Progressives Congress to participate for 2015 presidential election but e bin loose to Muhammadu Buhari for primaries. For 2017, oga Atiku bin return to di Peoples Democratic Party. For 2019, Atiku bin run di presidential race as PDP candidate and loose to President Muhammadu Buhari wey contest under di All Progressives Congress. Meanwhile, na afta e fail three times, na im President Buhari too finally realise im dream on im fourth try to become di president of di Federal Republic of Nigeria. As di race for who go become Nigeria president for 2023 continue, Nigerians still dey wait di ruling All Progressives Congress party, APC, to run dia presidential primary election so dem go fit sabi who be di pesin wey go dey di race for dem. Among di aspirants for APC na di party National Leader, Bola Tinubu, Nigeria Vice President Yemi Osinbajo and di Minister of Transportation Rotimi Amechi among odas. Peter Obi na anoda pesin wey go stand as ogbonge opposition for im ambition if e become di presidential flagbearer for di Labour Party afta e defect from PDP. Dis na di sixth time former vice-president Atiku Abubakar dey try im luck to be Nigeria president. Im come from Adamawa state, Northeast Nigeria. Atiku na businessman and politician. E contest to be govnor of Adamawa state two times. First, for 1990 and di second time na for 1998 before im become vice presidential candidate for 1999. For 1993, im contest di presidential position for Social Democratic Party presidential primaries wia im lose to Moshood Abiola and Baba Gana Kingibe. At 74, Atiku Abubakar still believe say im deserve di opportunity to rule Nigeria. Of all di aspirants from di PDP, Atiku na di oldest of di candidates and many pipo bin tok say im no get fresh ideas for di kontri. But Atiku get experience as one of di politicians wey bring PDP come for 1999. Even though im comot to join di opposition, like prodigal pikin im return to PDP. During im declaration, Atiku say if im win im go focus on five key areas of unity of Nigeria, security, economy, education and to carry resources and powers give federating units."	NIGERIA	https://www.bbc.com/pidgin/tori-61620043
