headline	text	category	urlMonkeypox cases dey investigated in Europe, US, Canada	"Health authorities don begin investigate cases of suspected and confam Monkeypox abroad. Monkeypox dey most common inside local areas for Central and West Africa, but now local media report am for America and Europe. Most recently dem confam one case for di US and dem dey investigate 13 suspected cases for Canada. Experts dey also look into cases for Canada, Spain, Portugal and di UK, according to local media report. Five infections dey confamed for Portugal as well as seven for Spain, health authorities tok. Dem dey always link di cases of di disease wey dem confam outside of di region to pipo wey travel go di area. Monkeypox na rare viral infection wey usually dey mild and most pipo dey recover from am in few weeks, according to di UK National Health Service. Di virus no dey spread easily between pipo and di risk to di wider public dey very low. Dem report di first case of di disease for di UK on 7 May. Di patient bin recently travel to Nigeria, wia dem believe say e catch di virus before e travel go England. Na wetin di UK Health Security Agency tok. So far dem don now confam nine cases for di UK. Dem neva confam di source but di di World Health Organization (WHO) say di cases dey ""locally acquired"" Dem don also report confam cases for Portugal and Spain afta dem alert European health agencies to di reports for di UK. And most recently, health authorities for di US state of Massachusetts confam one man don dey infected wit Monkeypox. Im bin recently travel to Canada, wia local media report say dem dey investigate 13 suspected cases of di virus. According to health officials, dem bin don hospitalise di man and e dey in ""good condition"" and ""e no pose any risk to di public"". Africa top public health agency tok am on Thursday say plenty plenty outbreaks of monkey pox for Africa don dey contained. E happun during di COVID pandemic even as di world attention dey oda places. He say di current outbreaks for Europe and di United States dey worry. Di acting director of di Africa Centres for Disease Control and Prevention say since 2020 outbreaks dem don see and contain di virus. Na for Democratic Republic of Congo, Nigeria, Cameroon and Central African Republic dem contain am. ""During dis pandemic, we don get many several outbreaks of monkey pox on di continent.... ""We also expect say oda outbreaks go come and we go handle am in di usual way."" Ahmed Ogwell Ouma tok am for one weekly news briefing. Ouma add say: ""We however dey concerned at di multiple countries outside, especially for Europe, wia we dey see dis outbreaks of monkey pox. ""E go be very useful if dem share knowledge regarding wetin really be di source of dis outbreaks,"" e tok. Monkeypox na rare but potentially serious viral illness wey dey start wit flu-like illness and swelling of di lymph nodes. Di sickness go later progress to a widespread rash on di face and body. Most infections dey last 2-4 weeks. Monkeypox na di same family of viruses as smallpox but dey cause a milder infection. CDC show say di patient dey infected wit a strain of monkeypox most commonly seen for parts of West Africa, including Nigeria. Infections wit dis strain of monkeypox fit kill about 1 out of 100 pipo. However, rates fit dey higher in pipo wey get weak immune systems. Before dis current case, US bin get at least six reported monkeypox cases in travelers wey dey return from Nigeria (including cases for di United Kingdom, Israel, and Singapore). Dis new case no dey related to any of dis previous cases. For di United Kingdom, several additional monkeypox cases dey happun in pipo wey get contact wit cases."	NIGERIA	https://www.bbc.com/pidgin/tori-61511611
Dei-Dei Abuja riot update: Fight force four markets close, at least five die - Fotos	"Four markets for Dei-Dei area of Abuja dey closed till further notice sake of 'civil unrest' wey happun for di Nigeria capital city. At least five pipo die inside violent clashes wey happun for dis local area on Wednesday Di markets wey dey ordered to remain close include di main Abuja Building Materials Market for Dei-Dei. Di Timber Market wey dem burn, oda markets for di area and all di shops and plaza wey dey along di Dei-Dei road also dey closed. Traders and shop owners dey make plans to beg goment to open di markets soon. Here na latest tori of how tins be for Dei-Dei area afta di tension wey lead to destruction of properties inside di Federal Capital Territory [FCT]. Minister of di Federal Capital Territory order di closure of all di markets, plaza and shops for di area. Na wen Muhammed Musa Bello visit di scene of di katakata on Wednesday evening e give di order. Oga Bello also meet all di leaders of di community for di area and request make dem close di Dei Dei market until further notice. Di decision go dey ground pending wen di authority complete dia investigation. E also confam say five pipo die for di 'civil unrest'. E tell di community leaders to fish out all di jaguda pipo wey get hand for inside wetin happun for Dei Dei on Wednesday and make sure say dem face di law. Oga Bello also promise say dem go upgrade di security post for di Dei Dei market to make sure say dis kain tin no happun again. ""I dey call on community leaders to fish out bad eggs inside dem and help bring dem to justice"". ""Dis na because dis time around, di hoodlums cari guns and shoot innocent pipo-dis dey very sad and we no go accept am for Abuja."" Di minister dismiss claim say wetin happun for Dei Dei na communal crisis. Oga Bello e say na case of jaguda pipo taking advantage of di tension wey bin dey ground to loot and destroy economic assets. One leader for di Abuja Building Materials market for Dei Dei follow BBC Pidgin tok as e narrate wetin hapun. Di trader also tok and how di closure of di market go affect dia pocket. Executive Vice Chairman of di market say all of dem dey for dia shop between 11 and 12 O'Clock wen di kasala burst. Chief Celestine Ekegbo say: ""We dey for our market dey do our business between 11 to 12 O'Clock na im we hear say kasala dey happun for outside we road. ""Okada cari one woman, and im and anoda Okadaman dey drag di road in di process dem com hit each oda. ""And woman come fall down anoda motor come climb her, she come die."" ""Pipo come gada sake of say wetin happun na horrible tin, to see how dem fit take resolve di mata. ""Some pipo wan beat di okadaman while odas wan save di Okadaman, na in di process di kasala start. "" Di market leader explain say na okada pipo (commercial motorcycle rider) and hoodlums(Jaguda pipo) na im start to fight, before dem go know, di tin don turn to anoda tin. ""Before you know it, e don led to burning of shops and destroying of motors, pipo wey dey pass we no know wetin dey happun, dem start to destroy glasses, katakata come full evriwia. ""For evening na im minister come wit di Commissioner of Police, Director of DSS wit oda security pipo for im team. ""Afta dem ask us questions e come order di closure of all di markets for Dei-Dei road both di shops and plaza"" E tok. E say dem don comply wit di directive of di Minister as evriwia for di market dey shutdown. ""We dey try to obey di directive of di Minister, no how wey we go close market wey e no go affect evribodi. ""Many pipo dey wey if dem no come out dem no go see food chopand feed dia families. Dis morning we don begin tok about how to make peace and see how our businesses fit open back"". E explain FCT Police Command tok-tok pesin Josephine Adeh for statement say dem dey investigate di mata. And dem go update di public in due time about di 'civil unrest wey happun for Dei Dei on Wednesday. Dei Dei na one area wey dey along di Kubwa /Zuba Expressway. Dem dey under di Bwari Area Council for Abuja, Nigeria capital. Commercial activities dey for di area, especially for di new site. Tori be say small small katakata like dis dey happun for di area, but dis type wey happun on Wednesday wey dem begin destroy pipo shops, market and cars neva happun before. Fotos from di Abuja Building materials market wey shutdown"	NIGERIA	https://www.bbc.com/pidgin/tori-61514548
Dada Habi Yar'Adua: Why Nigeria presidential aspirants dey visit Musa Yar'Adua mama	"Yar'Adua na household name for Nigeria sake of two political figures from Katsina state. General Shehu Musa Yar'Adua and President Umaru Musa Yar'Adua na di two household names. Di two don die since but dem leave a legacy of good name for area of governance. Lately, some presidential aspirants dey visit dia mama, Hajia Habi Yar'Adua. But why? Although for Africa, e good to dey respect mama and papa, BBC Pidgin try find out wetin dey special for here. Dem dey follow take picture or video to show say dem sef show for Mama Yar'Adua and Yar'Adua sisters side. Vice President Yemi Osinbajo, former Vice President Atiku Abubakar and former Senate President Bukola Saraki recent visit her. Former govnor Peter Obi, Govnors Emmanuel Udom and Nyesom Wike also don show face for Hajiyya Aya Dada side since dis year begin. And all of dem na Nigeria presidential aspirants from di two major political parties APC and PDP. However, di time wey some of dem go visit her be wen dem go to tok sorry for di death of a family member, recently. So make we chook eye look who dis mama be and why Nigerian presidential aspirants dey visit her house. One professor from di University of Abuja point to two reasons wey make. Professor Nazif Abdullahi Darma say di woman na pesin wey everibodi respect for north. E say politicians dey visit am sake of say she be mama of ogbongbe politician wey be former president of Nigeria. Darma tok say di mama for important to di north for politicians even though she no dey influence voting. ""If pesin dey find di acceptance of Katsina pipo and oda northers, politicians sabi say to visit dis woman go bring advantage for dem"". One political scientist for University of Abuja say no proof dey say to visit mama Yar'adua mean say you go get di votes from di north. Abubakar Kari tok say: ""But if you sabi politics, you go know say e dey likely say dem go blacklist dat kain candidate"". Karisay di mama dey respected but also tok say Hajia Dada no go fit make di move say dis na who pipo go vote for during election. Hajia Aya Dada Yar'Adua na di mama of ogbonge politicians dem from north-western Nigeria. Among her children na former Katsina govnor Umaru Musa Yar'Adua wey later become di Nigerian president. Di woman husband na minister during im own time and God bless dem wit pikin wey be president and deputy head of state. She also be di mama of Shehu Musa Yar'Adua wey be di vice president for Olusegun Obasanjo between 1979-1982. She also born Murtala Shehu Yar'Adua, wey work as minister under President Goodluck Jonathan. Anoda Nigerian mama wey suppose to dey receive politicians just like Umaru Musa Yar'Adua mama na late Obafemi Awolowo wife. But Hannah Idowu Dideolu Awolowo don die. For Nigeria, cultural acceptance get key role to play during election year."	NIGERIA	https://www.bbc.com/pidgin/tori-61511328
High blood pressure: How you fit manage hypertension plus treatment	"Hypertension, dey known as high or raised blood pressure, e be condition wia di blood vessels dey get much pressure. Blood waka from di heart to all parts of di body in di vessels. Anytime wey di heart beat, e go pump blood inside di vessels. Blood pressure dey shelle by di force of blood wey push against di wall of blood vessels (arteries) as di heart pump am . Di higher di pressure, di harder di heart ghas to pump. For inside one World Health Organisation report, dem say hypertension be serious medical condition and fit increase di risk of heart, brain, kidney and oda diseases. E be major cause of premature death worldwide, wit upward of one out four men and one out of five women BBC Pidgin follow sabi pesin on health mata, Dr Habibah Aminu wey be consultant wit di Federal Medical Centre Lokoja yarn and she explain how hypertension be. She yarn say Hypertension mean say blood pressure dey elevated. E fit be asymptomatic, dis one mean say, no symptoms at all. ""Dis na why e dey important to check your blood pressure wen you dey above 25 years old. I be see one 22-yr-old wey get high blood pressure di oda day, she add. Dr Habibah Aminu say she go like divide dis part into two: She add say di most common be headache, as most symptoms dey arise wen complications don set in. Di complications from hypertension simply mean say di result of blood pressure wey rise for body. Di brain, kidneys, eyes, heart fit dey affected, she tok. Dr Habibah Aminu also explain di kind hypertension wey dey affect brain, she say If e affect di brain, na stroke dem dey call am. And patients no go fit use dia limbs (example be right limbs or left limbs). Dia fit be tok wey no clear wit saliva wey dey comot side by side, dia fit even be coma depending on di location and type of di stroke. As extension of di brain, complications fit rise from tiny wires wey dey derived from di brain wey dem dey call 'nerves'. Na dis one dem dey call neuropathy. Patient fit get tingling or peppery sensations on di sole of dia feet or around dia eyes or head, e dey vary for different pipo. Some simple lifestyle changes fit help you reduce high blood pressure. Dr Habibah Aminu further tok say na from management prevention She add say , e dey unfortunate, say di fact say pesin be black African tilt you towards Hypertension, so pesin ghas work extra hard. According to Dr Habibah, wen pesin dey hypertensive, e ghas do secondary prevention, e mean to prevent complications If e affect di kidneys, dem dey call am Acute Kidney Injury or Chronic Kidney Disease. Di symptoms include reduced or no urinary output or even excess urinary output; Swollen feet and faces; General body swelling; Dizziness from low blood level. If e affect di heart, na Hypertensive heart disease dem dey call am. How dat one be be say, ""heart become enlarge and cause fluid to gather, wey lead to breathlessness, palpitation (awareness of your heartbeat), swollen feet, chest pain. If e affect di eyes, e fit lead to gradual visual impairment(make pesin no see wella) wey fit lead to total blindness. Your doctor go carry out some blood and urine tests, and ask questions about your health to determine your risk of oda problems: Source: NHS"	NIGERIA	https://www.bbc.com/pidgin/tori-61523211
'How I stand watch three of my friends die for my presence 	"Wednesday, 18th May 2022 na unforgettable day for pipo of Bichi town for Kano state (northwest Nigeria) particularly Idris Umar wey stand watch three of im friends drown inside Karaye dam as dem go bath in di morning. 25 year old Musa Abubakar, 23 year old Isyaku Bashir and 19 year old Nazifi Ibrahim all lose dia lives as dem enter dam to bath around 11:00am. Idris tell BBC News Pidgin say im and oda friends travel from Bichi to Karaye town on Tuesday for Majlisi wey be Hausa term for group of pipo wey dey come together to praise prophet Muhammad with hope of getting reward in the hereafter. Na some pipo for Karaye town invite us for di event and normally we suppose return to Bichi same day but dem beg say make we add some hours and as night reach we decide to spend di night for Karaye. In di morning, di pipo dey delay to bring bath water for us so one of us come advise say make we go river go bath and na so all of us begin waka go. Some of us no dey comfortable with di dam idea and tok say make we no go because something bad fit happun but Musa (among pipo wey die) jokingly tok say to nothing dey dia. Idris go on to explain wetin happun after dem reach di dam and how di three friends all die within minutes. Di dam get two parts e get di bigger side so we avoid dat part we come go di side wey di water small in fact we even meet some small children dey bath inside. Na Isyaku first remove cloth jump inside di water before Nazifi join am but 4 of us wey stand outside notice say after dem enter dem no show face na why Musa decide to enter to helep dem. As Musa enter we notice say something bad dey happun because dem no come up na so we begin shout dey call pipo to help. Unfortunately help no come in time because after 10 minutes wey about 20 pipo enter to help na dia lifeless bodies dem comot from di dam. Idris say im and di remaining friends no sabi swim na why dem decide not to enter to save dia friends. Father of Musa wey die say e no ever forget im final moments with im pikin before dem embark on di trip to Karaye town. I lie down inside room when Musa enter to greet me with im bag saying Baba we dey travel to Karaye town to go praise our prophet and i pray for am ask God to guide am. Di father say no be only im family go miss Musa as many pipo across Bichi dey benefit from am as e get two POS shops wey dey helep withdraw money. Tok tok pesin for Kano state fire service Saminu Yusuf confam di tori to BBC News Pidgin saying call for help no reach dia side on time and by di time dem reach di place local divers don remove di corpses from di dam. Our office for Karaye no get di call for help on time and by di time dem rush go dia dem don comot di corpses and police don already dey handle di case. E advise pipo especially strangers to avoid to enter water dem no dey familiar with. Two months ago landslide kill four friends for Yanlami village wey dey under same Bichi local goment as dem put hands together to build house for dia friend wey wan marry. Na just over a month bin remain for 25 year old Musa Jubril to marry Rabi Tofawa and as tradition for many villages across northern Nigeria im friends come together to helep am build mud house wey im and di wife go stay after di marriage. Hashim Yunusa na friend to Jubril and one of di two eyewitnesses wey see how di whole tin happun and e tok about di tragedy. So di plan be say di five of dem go dey inside di hole dey bring out di sand while me and Sani go dey outside dey pack di sand pour inside cart den transport to di site of di building. We don already go drop di first round infact before we go first time we dey even play and tease each oda and as we dey come back for trip two na im we just sight heavy dust na so we rush to di place only to see only one hand all of dia bodies dey covered. Na so we rush enter village go call pipo and before you know pipo don full di place even from neighbouring villages pipo come to helep but unfortunately by di time dem remove dem all of dem don die. For 2017, Government of Nigeria send message of sorry to di family of students wey die as dem dey do school trip for Kaduna, northwest side of di country. Di students bin dey attend one private secondary school and dem bin dey visit one waterworks facility when accident happen and lead to plenty deaths. Na for inside statement na im President Muhammadu Buhari say im dey ""very sad about tori say some students of Victory College, Ungwan Yelwa, drown inside di Kaduna River for di state capital. Last year plenty pipo die afta dia boat capsize and pipo drown for Bagwai river, Kano state North western Nigeria. Authorities say dem rescue seven pipo plus di 29 bodies wey dem recover. Eyewitnesses say di boat sink sake of overloading. Tori be say di boat bin dey carry more than 50 pipo from di village of Badau to di town of Bagwai, wia dem wan attend one Islamic religious ceremony. Same last year for May, Plenti pipo die afta di boat wey dem dey travel with sink inside river for Kebbi state, north west Nigeria. Di passengers wey many na women and children, with a few men bin dey travel from neighbouring Niger State when di boat capsize and pipo drown. At di time President Muhammadu Buhari describe di accident as ""devastating"", as im offer e condolence to di families of di victims."	NIGERIA	https://www.bbc.com/pidgin/tori-61506854
WAEC 2022 WASSCE: West African Examination Council exam offenses to sabi	"West Africa Examination Council 2022 WASSCE go see millions of students across Nigeria write di exam dis year. Di exam officially start May 9 and go finish for June 24, 2022 according to di time table wey WAEC release. ""Di candidates go sit exam for 76 subjects, made up of 197 papers, while about 30,000 teachers go participate for di examinations as supervisors."" Na so Head of Nigeria National office (HNO), WAEC, Patrick Areghan, tell tori pipo Guardian. WAEC results na wetin universities and polytechnics dey use to determine who dem go admit for dia school for parts of West Africa. So if you dey write WAEC dis year or you know pesin wey dey write dis tori go help you avoid problem wit di exam join body. Dis na wetin you need to know about di offense, . Odas dey inside di Council Regulations & Syllabuses dem. Di exam join body say dem dey cancel results wen dem find candidates guilty of examination malpractice. Di West African Examination Council, na international exam for Senior secondary school student wey dey happun every year. And at di same time across five kontris wey be member of di Council. Di kontris wia dem dey write WAEC na, Gambia, Ghana, Liberia, Nigeria and Sierra Leone, and dem dey use di same International Timetable. Na for 1952 dem establish am. According to information on top dia website, di vision of di West African Examinations Council na to be a world-class examining body wey dey add value to di educational goals of im stakeholders. WAEC na West Africa ogbonge examining board wey dey established by law to set di exams wey dey required in di public interest for di English-speaking West African countries, to conduct di examinations and to award certificates wey dey comparable to dat of equivalent examining authorities internationally. According to dia mandate, di council dey expected to assist in di development of sound education."	NIGERIA	https://www.bbc.com/pidgin/tori-61411949
Bauchi crisis: Police confam pipo injure, houses plus shops burnt afta youths riot over alleged blasphemy	"Nigeria Police say dia officers full everywhere across Warji local goment of Bauchi state for northwest Nigeria after some youths on Friday begin protest wetin dem describe as blasphemy to Islam. According to police statement wey dem release on Saturday na one 40 year-old woman allegedly post blasphemous message for social media wey lead to di kata kata. One eyewitness and member of di whatsapp group wia di issue begin describe to BBC News Pidgin how di whole mata take start. ""All of us na staff for Warji local goment including di woman so around 11am yesterday she post one video of somebody from Ghana wey dey abuse and criticise Islam and I respond to her post telling her to delete wetin she post but she ignore me."" ""We be about 20 for di WhatsApp group and 15 of us na Muslims so e dey wrong of her to post any anti Islam message for di group, so after I tell her to delete it about four other pipo also tok to her but she no respond in fact even our deputy director call her for phone but she no answer."" ""Na dat one make some pipo vex and before you know it around 5pm some youth begin gather to look for her lucky enough for her DSS quickly pick her up before di youth go reach her."" Di eyewitness wey dey Warji at di moment of dis report say no be true say dem burn church and pastor house for di kata kata. ""Di church and pastor house dey okay in fact as I dey tok to you I stand near di place security pipo full everywhere. But na true say some shops and houses burn sha."" Di commissioner of police in di state Umar Mamman according to di statement wey di tok tok pesin for di command SP Ahmed Wakili sign say things don dey calm now for di area and patrol teams still dey on ground. According to am, scores of pipo dey wunjure and dem burn down six houses plus seven shops burn for di Friday palava. E add say investigation don commence to fish out pipo behind wetin happun. Police also add say make elders dey always advise youth to avoid anything wey go cause wahala for dia community. Blasphemy na wen person insult or disrespect God, important pesin or object for particular religion or anything wen dem be consider as divine. For Islam, di mata na wen pesin disrespect or abuse important figures for di religion or any Islamic law. Di worst na wen pesin tok bad tin about God or prophet Muhammad dat one na death penalty. While odas like abusing or disrespecting top disciplines or islamic laws get various punishment According to experts, di blasphemy laws dey different and no be all dey lead to death. Divided between a Muslim north and Christian south, Nigeria get general nationwide laws against blasphemy wey Customary Courts fit interpret. Nigeria get specific Islamic laws against blasphemy wey Sharia Courts inside di twelve northern Nigeria states fit interpret. Di Customary law against blasphemy dey for Section 204 of di Criminal Code of Nigerian law book. Dat section forbid any act wey publicly insult any religion and put a prison sentence of up to two years as penalty. Yusuf Sani wey sabi Sharia law say afta Allah, next for Muslims na prophet Muhammad [SAW]. ""And anybody wey disrespect am fit get death sentence."" ""Even regarding disciples of di prophet dem get levels, for example Abubakar, Umar, Othman and Aliyu wey be caliphs and top figures for di religion; ""Dem no dey abuse or disrespect dem or punishment fit follow pesin."" Sani add. Recent blasphemy-related events wey don happun for Nigeria include:"	NIGERIA	https://www.bbc.com/pidgin/tori-61535867
