headline	text	category	urlChinedu Bernard: Nollywood actress die for church, reports	"Actors Guild of Nigeria don confam di death of Nigerian actress Chinedu Bernard. For post wey di guild national president, Emeka Rollas make for Instagram, im say Ms Chinedu die for Enugu on Friday. Nigerian media dey report say she die inside Church for di south eastern Nigerian city of Enugu. Di actress don feature for Nigerian moviews like Love Without Conscience, Just A Wish, Money Fever, Who Runs The City. Mr Rollas also announce say anoda budding actor by name, Chima Precious die for Abuja di same day. For im post, di President of di Guild say im don ""set up three man prayer committee to design prayer link wey members of di Guild fit join from all states."" Di death of di actors dey come at a time wey Nigerian entertainment industry dey mourn di loss of singer Osinachi Nwachukwu wey die on April 8. Popularly know as Choco for di movie industry, di actress come from Enugu State. Chinedu Bernard Okonokwo get over 20k followers for her Instagram page and be dey know by many for di movie industry as pesin wey get plenti potential. Her family never release statement concerning her death but reports say di church don deposit her body for mortuary."	NIGERIA	https://www.bbc.com/pidgin/tori-61283209
Elon Musk buys Twitter: 'Buy Nigeria' twitter user beg World Richest Man Elon Musk	"Elon Musk tweet wia e tease to buy Coca-Cola receive reply to buy Nigeria wey cause buzz. ""Abeg, try buy Nigeria and give us 24 hrs electricity. Nwoke oma bikonu."" Na so di twitter user wit ID @AfamDeluxo reply Elon Musk. Di reply from Aji Bussu handle [@AfamDeluxo] later set Twitter on fire with many users supporting di request. Bussu tweet don get ova 6000 likes and counting. Elon Musk recent tweets dey go viral afta di Tesla CEO strike one deal to buy Twitter. Dat deal to buy Twitter from di founder, Jack Dorsey dey worth about $44bn. For im bid to buy Twitter, Musk promise to reduce censorship on di social media micro blogging site. Musk Coca-Cola tweet don attract ova 528,000 retweets, 140,000 quote tweets, 3.4million likes and counting. Since afta dat reply to Musk Coca-Cola tweet, ""Buy Nigeria"" don get more than 10,000 mentions on Twitter. But in reality, dat twitter user, Aji Bussu, request no fit dey possible or come through because of many reasons. Nigeria no be commodity, na kontri inside west Africa and e no dey up for sale. However Nigerians dey in dire need of any 'messiah' wey fit solve di growing social concerns for di kontri. Nigeria cover area of 923,769 square kilometres and get estimated population over over 200 million pipo. Some Nigerians believe say di company new leadership under South African-born Musk, no go stand wit dem in dia time of need. Twitter get an estimated three million Nigerian users, na important space wia kontri pipo dey take hold goment accountable. And Nigerians dey use am mobilise for political and social causes. Na di social media platform help push #BringBackOurGirls, one rescue campaign for more than 200 schoolgirls Boko Haram bin Kidnap for April 2014. Twitter also push hash tag #EndSARS, wey be movement against police brutality and extrajudicial killings for di kontri in October 2020. Last year, Twitter, under im past CEO and founder, Jack Dorsey, bin come under fire from di Nigerian goment. For early June 2021 di Federal Goment bin ban di platform from operating for di kontri for seven months. Twitter wahala wit di goment start afta dem bin delete one tweet from President Muhhamdu Buhari. At di time, dem tag am ""genocidal"" and say e dey against di platform policies. Elon Musk na 50-year-old businessman. Dem born am for June 28, 1971 for Pretoria, South Africa. Im dey known as South African-born American entrepreneur. Musk establish di electronic-payment company PayPal. Na him form SpaceX, wey dey make launch vehicles and spacecraft. Im na also di chief executive officer of di electric car manufacturer Tesla. Forbes for dia latest report list Elon Musk as di richest man in di world. Musk describe im childhood as difficult, coloured by im parents' divorce, bullying at school. And e tok about im own difficulty reading social cues due to Asperger's Syndrome. Forbes and Bloomberg now rank Elon Musk as di world richest pesin, with a net worth of about $250bn. Im dey tens of millions more than im nearest rival, Amazon founder Jeff Bezos. Elon Musk net worth dey based largely on di value of im shares inside Tesla, of which e own about 17%. E also champions digital currencies and get a hand in several oda smaller companies. Dis include tunnel-maker di Boring Company and experimental brain-computer start-up Neuralink."	NIGERIA	https://www.bbc.com/pidgin/tori-61249662
Nigeria Bureau of Statistics reveal how Nigerians dey spend more money on transportation	"One new report wey di National Bureau of Statistics (NBS) drop don tok say Nigerians pay more moni for transport fare for March dan di previous month across different parts of di kontri. NBS drop dis one for inside one report about transport moni, wey im title be 'Transport Fare Watch (MARCH 2022)'. Dis na as state goment still dey struggle to pay minimum wage of 30,000 naira wey federal goment announce since 2019. Di report tok about all aspect of transport like bus journey witin di city per drop. Intercity, state route, charge per pesin; airfare charge for routes single journey; journey by motorcycle, wey pipo sabi as okada, and waterway passenger transport. Consumer inflation wey rise for February afta one fuel shortage gbege bin burst dat time helep push up di price. Di incident bin cause serious queues for filling station for weeks, and e make pipo begin find desperate option to fit get fuel. Di report say di average transport moni wey air passengers for particular routes single journey, bin rise by 4.43 per cent for month-on-month from N44,825.04 for February 2022 to N 46,810.62 for March 2022"". ""For year-on-year, di fare bin rise by 28.26 per cent (N36,495.41) for March 2021. ""Di average moni wey pipo wey dey do bus journey intercity per drop dey pay bin rise to N3,270.94 for March 2022, dis one show increase of 5.29 per cent for month-on-month if we compare am to di value of N3,106.72 for February 2022. Di moni, rise by 35.65 per cent (N2,411.29) for year-on-year, for March 2021."" Di average moni wey passengers pay for bus journey within di city per drop, di report show say e increase by 4.41 per cent for month-on-month from N513.72 for February 2022 to N536.35 for March 2022. Di average moni wey passengers pay for bus journeys inside city per drop bin rise by 42.17 per cent from N 377.27 for March 2021 to N536.35 for March 2022. ""For another category, di average moni wey pipo wey dey journey by motorcycle pay per drop bin increase by 4.22 per cent for month-on-month from N379.12 for February 2022 to N395.12 for March 2022,"" di report add. ""Also, for evri year, di moni bin rise by 45.57 percent from N 271.44 for March 2021 to N395.12 for March 2022. ""Di average moni for water transport (waterway passenger transport) for March 2022 bin drop to N890.03 as e show decrease of 2.53 per cent for month-on-month from N 913.13 for February 2022. On year-on-year, di fare bin rise by 10.10 per cent from N 808.38 for March 2021 to N890.03 for March 2022."" Fuel scarcity and pump price increase sef dey thereSince February 2022 wey Nigeria petroleum company NNPC bin carry bad fuel enter di kontri, kontri pipo never see one ogbonge relief from di kasala wey di error cause.Di shortage na im helep sky rocket transport moni and dis one don dey affect price of goods and commodities.Meanwhile, sabi pipo say more global increase for fuel price still dey come sake of di war wey currently dey shelle between Russia and Ukraine.Nigeria wey be Africa largest oil producer still dey rely wella on imported fuel sake of refinery wey no work and inflation rate don already rise to 15.7%. Di current price of petrol be N162/163 per litre for most major petrol stations and independent marketers dey sell am for N165/litre. Despite plenti promises wey NNPC bin give say dem go end di shortage, e still never show as transport moni still dey go up. On Wednesday, October 23, 2019, Federal Government afta plenti meetings wit di Nigeria Labour Congress finally announce to start to pay N30, 000 minimum wage to im workers. Around November last year, di Federal Government through di Chairman National Salaries, Incomes and wages Commission, Ekpo Nta say dem go soon begin monitor implementation of di National Minimum Wage Act 2019, wey increase di minimum wage for Nigeria worker from N18,000 to N30,000. Ekpo Nta, bin tok for one news conference for Abuja say dem go be interagency collaboration wey go gather evidence of compliance and wahala wey workers dey faceso dem go fit advise all employers, including goments at all levels. Dis one mean say as at late last year no be all Nigerian workers don dey receive di N30,000 minimum wage moni. Yet price of commodity for market continue to rise. Pipo wey dey affected pass for dis transport moni increase be low income earners wey dey yet to receive N30,000 minimum wage from di goment. Wetin be di Minimum wage for oda kontris?Nigeria minimum wage be N30,000 ($72) per month. Di minimum wage for Ghana change for January 01 2022 from 12.53 cedis to 13.53 cedis per day.Di United Kingdom National minimum wage from April first 2022 be 9.50 from 2021 8.9 per hour, e rise by 6.6%.Di United States minimum wage dis year be $7.25per hour."	NIGERIA	https://www.bbc.com/pidgin/tori-61233063
Yul Edochie new wife Judy Austin Muoghalu wey di Nollywood actor announce say im welcome pikin wit spark reactions	"Ogbonge Nollywood actor Yul Edochie don reveal say im welcome baby boy wit im second wife, Judy Austin Muoghalu. Di actor bin make di revelation on im Instagram page and share fotos of im son and im second wife as im disclose say e love di boy di way im love im oda children. For di post wey im make on Wednesday, 27 April, Yul tok say di boy name na Star Dike Munachimso Yul-Edochie. As Nigerians for di comment section dey express dia surprise, di first wife May Yul-Edochie drop her own comment too. Di woman write: ""Na God go judge both of una."" Some oda ogbonge actors wey be Yul colleague also express dia surprise say Yul get second wife and say di woman don born for am. Actress Shan George also dey surprised as she enta di comment section to ask if di revelation dey real. She tok say she dey shocked but also congratulate Yul if di revelation dey real. ""Wait o Yul, for real? Di shock wey shock me now, I need to eat, abeg make someone send me urgent 2k biko, no food for my house, make I no faint here. Congratulations if e dey real, sweet baby,"" Shan tok for di comment section. Anoda actress Joyce Kalu tok say ""dis life no balance."" Apart from pipo wey dey disappointed and express dia surprise for di comment section, oda Nigerians congratulate di actor on di birth of im baby boy. Yul Edochie na di son of ogbonge actor Pete Edochie. Yul wey join acting many years ago don star for different popular movies and some of dem include Idemili, Devil in Red, and Show Down. Apart from say im be actor, Yul na also politician and im don tok say e go like be Nigerian president for 2023. Di actor wey be forty-years marry im first wife Judy wen im dey 22 years. Yul second wife Judy Austin Muoghalu na actress and both of dem don act for different movies togeda. Judy come from Anambra State and she don feature for different movies and some of dem na Native Girl, Fear The Street Girl I love, Where I belong, Trouble Comes to Town, and Secret of The Riches. Yul Edochie first wife na May Yul-Edochie and both of dem don marry since 2004. Di couple celebrate 17 years wedding anniversary last year. Ontop one post wey Yul put on Instagram to celebrate dia 17 years wedding anniversary, di movie star thank im wife for di love and support always and add say im truly appreciate and love her. According to her Instagram page of over 130k followers, May na entrepreneur. Yul and May get four pikin togeda, three boys and one girl. As di second wife don born for di movie star, e mean say Yul don get five children. One of Yul pikin wey be girl currently dey for higher institution and di actor dey always post fotos of dem togeda on social media."	NIGERIA	https://www.bbc.com/pidgin/tori-61247468
Indonesia ban export of palm oil: Wetin e mean for Africa wia Nigeria be largest producer	"Indonesia don ban export of any kind of palm oil wit immediate effect. So wetin e mean for Africa? Di Southeast Asian kontri dey account for more dan half of world palm oil supply, don sama ban on anykind Wetin cause di export ban be say Indonesia pipo don start protest against increase for di price of cooking oil. Di price increase don disturb dia local supply. So di question now be say wia Africa wey dey import oil wela go turn to next for supply. For 2021, Africa bin spend five billion dollars to import estimate of four million metric tonnes of palm oil from Indonesia and Malaysia. One tonne of palm oil be about $1,850 for di commodity exchange for Kuala Lumpar, Malaysia. E den add, anoda 150 to 200 US dollars for transport and handling costs, per tonne. Dis mean say, di real cost to deliver one tonne of palm oil anywhere on di continent be about $2,000. Wetin dey dia be say, di ban fit expose Africa largest producer of palm oil-Nigeria wey be former world largest producer for di 1960s. Nigeria bin dey produce one small 1.4m metric tonnes for 2021, compare to Indonesia 44.5 million metric tonnes. Di ban dey come just a month since global sunflower oil supply bin dey thrown off-balance. Na di Ukraine-Russia war, as dat one bin add pressure to household budgets. Indonesia restriction on exports, go now dey somehow for Africa pipo wey dey already struggle wit di effects of high fuel and food price sake of global supply chain wahala. Already, di price of product like soap and cooking oil don increase and di situation fit only get worse. Palm oil dey in use wella to manufacture vegetable oil. But e get plenti products wey dey comot from palm oil: Frying fats, cosmetics and cleaning products like soaps. Importers like India, Bangladesh and Pakistan go try buy more palm oil from Malaysia. But di world second-biggest palm oil producer no fit fill di gap wey Indonesia create sake of labour shortage. Indonesia mostly dey supply nearly half of India total palm oil import. While Pakistan and Bangladesh import nearly 80% of dia palm oil from Indonesia. Connie Magomu, di General Manager, National Oil Palm Project, for Uganda say di ban sef be opportunity. Magomu see am as good chance for Africa kontries to develop dia own palm oil sector. ""E dey very efficient for land use, as e dey produce more oil per unit area dan any oda crop wey we sabi (E dey give between four to 10 times more oil per unit area)."" ""E be also one good crop for poverty reduction sake of once e reach maturity for three and half years. ""E go dey harvested every 10 days for 20 to 25 years"", She add. Uganda don dey promote local production of palm and need at least 100,000 hectares to dey self-sufficient. Kontries for Africa wia di opportunity to grow and expand di production of di commodity be: Nigeria, Ghana, Ivory Coast, Sierra Leone, Uganda, Burundi, DRC Congo and Tanzania."	NIGERIA	https://www.bbc.com/pidgin/tori-61260168
Chidi Mokeme, Soso Soberekon: Nigerians share encounter wit traffic robbers in Lagos	"Nollywood actor, Chidi Mokeme and Music executive/producer, Soso Soberekon don share dia experience of how traffic robbers for Lagos attack dem. Di two Nigerian celebs wey experience dis attack separately, say dem dey able to escape without any hurt but di robbers damage some parts of dia motor glass. For Chidi Mokeme, di attack happun around Victoria Garden City area of Lagos as im dey hurry go airport to enta plane and travel out from Lagos. While Soso Soberekon no tok wia exactly im attack for happun inside Lagos but e share video of im white Range Rover wey di robbers break di glass. For one long post for Instagram, Chidi Mokeme narrate how di incident take happun and how e take manage escape. ""So here I dey stuck for inside Lagos traffic, in front of VGC to be precise, and dey wonder if, and wen I go make am on time for my international flight,"" di actor tok. ""...For my korokoro eye like dis... all of a sudden, out of nowhere, I notice one white Honda Accord dey try to box me in, someone jump in front of my truck and start to dey signal ""Stop dia, I say stop dia "" Chidi Mokeme say e no gree stop at all as e quickly calculate di situation and observe say na danger. ""E wear plain clothes, no uniform, and dey try put hand inside trouser, im accomplice dey run ova from di oda side of di road and motor wey dem wan use run dey on standby."" ""I take di only option, almost jam am and climb di culvert, enta di service lane to oncoming vehicles."" ""I get di opportunity to quickly look di guy for my rear view mirror, e dey try bring out sometin, I no know wetin e be but I divert, next thing I hear na loud explosion."" ""My glass scata and piece of am fall ova me in all directions,"" di actor add. Mokeme say e no stop im car but continue moving and take control of di situation. Soso Soberekon call di attention of di Lagos State Governor, Babajide Sanwoolu for di post wey im put for Instagram to share im experience ""@jidesanwoolu di traffic robberies for Lagos don dey get too much, do something as soon as possible."" ""From Lekki express way, Freedom way, Ojota, Oshodi no wia dey safe."" ""As for you robbers wey try to rob me, Shey una see say no be everybody way eh easy to rob from?"" Before now, some resident of Lagos state, Nigeria don bin complain about di constant attack from traffic robbers. Sake of dis, some Lagosians don enta social media to call on di attention of di state governor and police to address di situation while some odas share dia experience; On 20 April, 2022, Lagos State police tok-tok pesin, SP Benjamin Hundeyin chook mouth for di traffic robberies wey dey happun for Lekki-Ajah area. E say di commissioner of police don give marching order to di Area Commander for dia to stop dis ugly experience; ""Concerning di early morning traffic robberies for di Lekki-Ajah axis, di Lagos State Commissioner of Police, CP Abiodun Alabi, fdc, mnim, psc don give marching order to di Area Commander wey dey cover dat axis to nip di ugly emerging trend in di bud,"" oga Hundeyin tok for twitter."	NIGERIA	https://www.bbc.com/pidgin/tori-61261051
Jodie - Kuchi-kuchi singer say strangers bin advise her to kill her son as she cry out for help	"Popular Nigeria music artiste Jodiegreat don cry out say make pipo help am wit moni to take care of her pikin wey get special needs sake of Cerebral palsy disease. Jodiegreat become popular for 2010 afta she drop one hit single 'Kuchi kuchi'. For one Instagram post on Wednesday, Jodie bin write one long tori wia she take make di appeal and also tok about her child condition. For di post, she bin write say, she no be lazy pesin. ""I bin sing one song, Kuchi Kuchi for 2010, wey Kings and Queens don listen to and enjoy. I dey use di soft spot wey dat song fit don create to make dis appeal. ""For di past six years, I don hawk beaded jewellery for office like Total, Noah's Ark, DDB etc. I don sell hair care products, I don beg. I don borrow. Nigerians dey kind"". She add say true-true , she be 'NOBODY', but dey inspired, years ago to sing one song wey still dey till date. ""Who sabi? Maybe di reality be say Kuchi Kuchi no be for my popularity, but to answer to di silent cry of mothers wey born special needs children. She also add say maybe di reality be to speak for di blood of di special needs children don spill for secret by helpless mothers wey no sabi wetin else to do. ""I know dis, sake of some strangers don advise me to kill or abandon my son, sake of say children like dat, dem dey send am to swallow moni, she tok"". She add say her moni don dey swallowed and her friends don abandon her, sake of say she be beggar. ""My debts dey new every morning. But I be mama wey go rather die first before her son no eat. Jodie add say, special needs children no dey eat normal food. Dem need plenti medical, emotional, etc care. Special need children require di help of well established world-class organisations, because no be dia fault say dem born dem dat way. Di Delta state born singer bin don dey struggle to deal wit her pikin condition since she born am. For 2017, she bin grant TV interview to explain wetin she dey go through since she born her pikin wey doctors say get Cerebral Palsy. According to Sabi pipo, Cerebral palsy be one group of disorder wey dey affect pesin ability to move and maintain balance and posture. Di condition be di most common motor disability in pikin. Cerebral mean say e get something to do wit di brain. Palsy mean weakness or problem to use di muscles. Wetin dey cause Cerebral Palsy be abnormal brain development or injury to di brain wey dey develop wey affect pesin ability to control dia muscles. Di symptoms of CP dey different from pesin to pesin. Pesin wey get serious CP fit need to use special equipment to be able to walk, Or fit no dey able to waka at all and fit need lifelong care. Pesin wey get mild CP, fit dey able to waka small wit no balance, but fit no need any special help. CP no dey get worse ova time, though di exact symptoms fit change over pesin lifetime. All di pipo wey get CP get problem wit waka and posture. Many also get conditions wey relate like make dem no dey too sharp; seizure; problem wit vision, hearing, or speech; changes for di spine (like scoliosis); or joint problem (like contractures)."	NIGERIA	https://www.bbc.com/pidgin/tori-61247288
How security guards 'dehumanize me, shave my hair'	"Police for Benue state don arrest four pipo in connection wit one viral video wey show how some members of di Hunters and Forests Security Guard dey use scissors shave one female students hair for Makurdi, Benue State. Di govnor of di state Samuel Ortom describe di action wey spark outrage among Nigerians as unlawful and appalling and reveal say im goment no get anything to do wit di security outfit. Inside one statement by im tok-tok pesin Nathaniel Ikyur, di govnor charge di police to investigate di mata wella and make sure say justice dey served. BBC Pidgin reach out to Doom Usugh to narrate wetin lead to di incident. Di 22-year-old say she no fit sleep for night days afta officers of Hunters and Forest Security Guard, allegedly beat her and shave her head. Mrs Doom wey be 200 level Theatre Art student of di Benue State University dey cook as side hustle and she say she bin go deliver food to one of her customer and as she dey return, near di Wurukun axis na im officers of di hunter guard stop dem and surround her wit dia weapon. ""I bin dey very terrified wen dem surround me wit dia weapon and begin insult me,"" Doom tell BBC Pidgin. ""Dem [allegedly] begin call me ashawo and begin beat-beat me wit blow and slap and say na pipo like me dey seduce men and boys to di do bad tins. She claim say di hunters, ""come use unsterilized scissors begin cut my hair sotey dem cut my scarf join,"" she yarn Doom say she dey suffer body and chest pain sake of how dem allegedly manhandle her, as she no fit tok pim wen she see dia gun. ""As dem di beat you dem go dey brag say if you do anyhow dem go shoot you and noting go happun"" she took ""I neva get dis kain experience for my entire life befor- e dey even make me shame to tok about am and waiting I want na justice- not onli for me but all those wey dem assault. One of di video wey show face for social media begin make pipo of di state para- some come di call make dem arrest those wey commit di crime. Sake of di outcry, di Benue State govnor, Samuel Ortom for statement order for di immediate arrest of di leader of di hunter group wey im describe as illegal. Di govnor say di Hunters and Forest Security Guards no be agency of di state goment and dat di goment no get any relationship wit dem. Govnor Samuel Ortom ask di police to properly investigate di mata and ensure dat those wey get hand for di incident face di wrath of di law so dat e go serve as warning to those wey wan try dat kain tin for future. Di Nigeria Hunter Council don deny say those wey cari out di shaving of girls for di street of Makurdi na dia members. One officer of di service tell BBC Pidgin say di pipo wey cari out di crime na alleged cultist and dat dia plans na to ruin di name of di organisation. E say dia preliminary investigation reveal say dem stage di shaving so dat e go give dem bad name and prevent di president make e no assent to dia bill. Sake of di security situation for Naija, hunters don dey involve wit security operatives to fight Boko Haram and oda jaguda pipo for inside bush. Sake of dat recently, di senate pass into law one bill wey dey seek to establish di Nigerian Hunter Council (NHC) wit di mandate to prevent Forest Crime, Prevention of Bush and Forest Fire. Plus make dem fir arrest, Investigate and handover dem to di Police for further prosecution of any pesin wey dem catch di commit any form of Criminal activities for inside forest. Di agency dey under di ministry of interior and Nigeria President neva put im signature to di law."	NIGERIA	https://www.bbc.com/pidgin/tori-61257167
