headline	text	category	urlAPC Presidential primaries: Bola Tinubu, Yemi Osinbajo, Rotimi Amaechi, Yahaya Bello - Meet APC aspirants wey wan replace Muhammadu Buhari as President	"Election season don start for Nigeria and di race for who go replace President Muhammadu Buhari for Aso rock don dey hot. For im party - di ruling All Progressives Congress - about seven aspirant don declare dia interest to run for di highest office for di land. Di kontri general election go happun for 2023, according to di Independent Electoral Commission. Next year Presidential and National Assembly elections go happun for February 25, 2023 according to di election office INEC. While govnorship and state assembly elections go hold for March 11, 2023. INEC don give all political parties for di kontri deadline of June 2022 to do dia primaries and produce dia candidates wey go fly di party flag for di general election. Dis na guide to who dem be. Yemi Osinbajo na Nigerian lawyer, professor, and politician wey be di 14th and current Vice President of Nigeria since 2015 under di All Progressives Congress (APC). E serve as Attorney General of Lagos State from 1999 to 2007 and hold di title of Senior Advocate of Nigeria (SAN). For 1999, Osinbajo gbab appointment as Attorney-General and Commissioner for Justice for di cabinet of Lagos State Govnor Bola Tinubu. Afta e serve during both of Tinubu four-year terms, Osinbajo comot goment for 2007 and return to law. E follow dey do lecturing plus preaching for di Redeemed Christian Church of God. Before di 2015 presidential election, dem chose Osinbajo as running mate to APC nominee Muhammadu Buhari. Na dia ticket defeat di den-incumbent President Goodluck Jonathan and Vice President Namadi Sambo. Four years later, im win re-election. Bola Ahmed Tinubu alias Jagaban, na man of many parts and im don dey very active for Nigeria political life for many years now. Di 69 years old get reputation as a political godfather wey dey use im power and influence to support im candidates. Im na accountant wit degree from Chicago State University for United States, and im work for major companies including Mobil Oil Nigeria before im win senate seat for 1992. E later go on exile during di rule of military goment sake of im bin dey involved wit di pro-democracy National Democratic Coalition. Afta di death of military leader General Sani Abacha, im return for 1998 and immediately return to politics. Bola Ahmed Tinubu na two term govnor of Lagos state from 1999 to 2007. Although im bin no hold any political office afta 2007, but e get hand for di grooming of Lagos state govnors since den. Jagaban describe imsef as ""talent hunter"" wey dey ""put talents for office, I help dem,"" im tell tori pipo Reuters for 2015 during Lagos govnorship election. Rt. Hon. Chibuike Rotimi Amaechi na Nigeria Minister of Transportation and former Governor of Rivers State. Dem born am for Ubima, Ikwerre Local Goment Area of Rivers State on 27th May, 1965 to late elder Fidelis Amaechi and wife Mrs. Mary Amaechi. Amaechi start im educational for St. Theresa primary school from 1970 to 1976, where e pass im first school leaving certificate. Afta dat e proceed to Government Secondary School Okolobiri for 1977, finish dia and get im West African School Certificate for 1982. Amaechi later attend University of Port Harcourt for 1983, wia e graduate with honours degree in English Studies and Literature for 1987. Na for University of Port Harcourt e lay di foundation of im political life. Amaechi later become Rivers State Governor for 2007 to 2015 under PDP ticket. E also become Nigeria govnors forum chairman within dat period. For 2015 Ameachi become di Director General of President Muhammadu Buhari Campaign Organization. E occupy dis position again for 2019 afta Buhari bin appoint Transportation Minister wen e form him cabinet after 2015. And him still hold dat position till date. David Nweze Umahi, na two term govnor of Ebonyi state - e become govnor for 2015 under im former party, Peoples Democratic Party (PDP). E later join di All Progressive Congress (APC) for 2020. Dem born Umahi wey from Uburu for Ohaozara local goment area of Ebonyi State for for January 1964. Umahi enta politics early and by 2007 e become di acting chairman of di Ebonyi State chapter of di PDP. From 2009 to 2011 e serve as state chairman of di party. Oga Umahi later serve for di governing board of di Federal Medical Centre for for one year. Yahaya Bello na one of di youngest aspirant for di presidential race at 46 years old. Na 18th June 1975 dem born am and e from Agasa, Okene Local Government Area of di state. Bello na di be present govnor of Kogi state, for North Central region of Nigeria. E attend Government Secondary School Suleja for Niger State wia e obtain im Senior School Certificate Examination for 1994. From dia e attend Ahmadu Bello University Zaria to study Accounting wia e graduate for 1999. E go back to Ahmadu Bello University, Zaria to obtain a Master's degree in Business Administration in 2004. Im be di fourth democratically elected govnor of Kogi State. Rochas Okorocha na past govnor of Imo state and current Senator wey dey representing Imo West Senatorial district for di 9th national assembly. E serve as govnor from 2011 to 2019 first wit All Progressives Grand Alliance (APGA),before e decamp to di All Progressive Congress. Na APC okorocha dey now. Aside politics Okorocha na businessman wey get several investments for Nigeria like real estate. E also be philanthropist wey get foundation wey e dey use help poor children. At 59 years, Okorocha na one of di experience politicians for im party, because him don contest for di position of president before. Na 22 September 1962 for Ogboko, Ideato South, for Imo State dem born am. Dr. Kayode Fayemi na former Minister of Mines and Steel Development and present Govnor of Ekiti state. E serve as minister from 2015- 2018. During im tenure as Minister, he also serve as Chairman of di governing board of Nigeria Extractive Industries Transparency Initiative. Dr. Fayemi get degrees for History and International Relations from di University of Lagos and Obafemi Awolowo University respectively. E also get Doctorate in War Studies from King's College, University of London and na Fellow of di Centre for Peace and Conflict Studies, University of Ibadan. Fayemi na former coordinator of di Progressives Governors Forum and a two-time Chairman of di Nigeria Governors Forum. E say him entry into di race go rebirth a new Nigeria. Dem born Godswill Obot Akpabio for 9 December 1962. E complete im primary education for Methodist Primary School, Ukana, and from dia go Federal Government College, Port Harcourt, Rivers State for im O' and A' levels certificate. Akpabio Study Law for University of Calabar and attend Nigeria Law School for Lagos. E do work as teacher and for small time practice for Paul Usoro and Co. wey be law company. And work for EMIS Telecoms Limited wia im become company Managing Director. Akpabio journey inside politics begin for early 2000. E serve as Commissioner for Petroleum and Natural Resources for Akwa Ibom state. 2007 e become Akwa Ibom State Govnor under Peoples Democratic Party (PDP) ticket. Enta for second time for 2011. 2013 e become chairman PDP Governors Forum. 2015 e win Senatorial seas of di Akwa Ibom North West Senatorial District (Ikot Ekpene). 2015 e become Senate Minority Leader. August 2018 - Senator Akpabio resign as Senate Minority Leader and port to All Progressive Congress. July 2019 - President Muhammadu Buhari nominate am for Minister for Niger Delta Affairs. Senate confam am di following month for August 2019. For 2019, Economic and Financial Crimes Commission (EFCC) bin investigate oga Akpabio ontop alleged N100 billion (N258 million) fraud during im 2007 to 2015 time as govnor, although di corruption police no file any criminal charge las las. Shina Peller na lawmaker from Oyo State, southwest Nigeria wey dey represent Iseyin, Itesiwaju, Kajola and Iwajowa in di House of Representatives. Di lawmaker na di son of ogbonge magician, Professor Moshood Abiola Peller. Shina Peller na businessman get Bachelor Degree in Chemical Engineering from Ladoke Akintola University of Technology (LAUTECH). Im also get Master Degree in Business Administration. Di lawmaker nai get di popular Quilox Bar for Lagos, southwest Nigeria and pipo regard di Iseyin indigene as di king of nightclub. Im don dey represent Iseyin, Itesiwaju, Kajola and Iwajowa in di House of Representatives since 2019 afta e defeat im closest opponent from di Peoples Democratic Party, Najeemdeen Oyedeji. Adams Oshiomhole na former governor of Edo State, south-south Nigeria. Im lead di state from 2008 to 2016. Before Oshiomhole become Edo govnor, im be serve as di president of di Nigeria Labour Congress from 1999 to 2007. Im serve as di chairman of di All Progressives Congress from 2018 to 2020. Di National Executive Committee of di APC komot Oshiomhole as chairman of di party in 2020. Im study Economics and Industrial Relations at Rustkin College, Oxford, United Kingdom. Oshiomhole don work for di Arewa Textiles Company before. For 1982, di National Union of Textile, Garment and Tailoring Workers of Nigeria, a union with over 75,000 workers, appoint Adams Oshiomhole as dia general secretary. Ibukunle Amosun na senator and former govnor of Ogun State for southwest Nigeria. Na January 25, 1958 dem born am. E serve as Govnor for di Gateway state from 2011 to 2019. Senator Amosun na qualified accountant wey attend University of Westminster for London, United Kingdom wia e acquire Master of Arts in International Finance. Before e go school for UK e bin attend Ogun State Polytechnic, wia e graduate wit Higher National Diploma for 1983. Amosun during im declaration speech for president tok wia e go focus on. ""Di two pillars of di agenda wey I go torchlight in di weeks ahead na national security and economic development,"" e tok. ""Ontop dis two pillars, we go create a national architecture for human flourishing wey neva happun before for our national history."" Amosun add put Dr Tunde Bakare na pastor and founder of The Latter Rain Assembly church. Na November 11, 1954 for Abeokuta, Ogun State dem born Pastor Bakare into Muslim Family. Pastor Bakare say im journey into Christianity begin for September 24, 1974. E start im ministry for May 1988 wia e pioneer di first Model parish of di Redeemed Christian Church of God. Pastor Bakare na qualified lawyer, e do im call to bar for 1981. Im practice law wit Gani Fawehinmi Chambers, Rotimi Williams & Co and Burke & Co, Solicitors. Before him establish im own law firm Tunde Bakare & Co (El-Shaddai Chambers) for October 1984. Pastor Bakare na minister wey like to torchlight national issues. Im political journey start for 2011 wen im become running mate to Muhammadu Buhari for di now-defunct Congress for Progressive Change. Tein Jack-Rich na di founder of Belemaoil Producing Limited. Jack-Rich wey hail from Rivers State announce on Friday, 13 May say im go run for president on di platform of di All Progressives Congress. Dis na afta im submit im N100 million presidential forms to di party. Di 47-year-old entrepreneur study Petroleum Production Technology for Panola College Cartage, United States. Im also study Business Administration for di University of Wales, and Business Management for Usam University. During im speech as im formally declare for president, Jack Rich tok say e go focus on youth and women empowerment, infrastructure and job creation if e enta as president. Sobeye El, lawyer and APC member. Wit few weeks to di APC party convention more candidates don join di race to contest for president. Ekiti state govnor Kayode Fayemi and former Govnor of Akwa Ibom state Godswill Akpabio na di new faces for di race. As tins be so di fate of dis aspirants dey in di hands of di 7800 APC delegates wey go vote to select di candidate wey go fly di party for 2023 general election. See di break down of di number of delegates and dia regions hia: BBC Pidgin speak wit Sobeye Eli wey be lawyer and APC member for Rivers state to torchlight di presidential aspirant race for di ruling party. And dis na how him explain di matter for us. Di south west next to di north west na di biggest stronghold of APC in terms of di number of delegates wey go attend di national convention. ""Na natural tin as di party get stronghold dia, more hands go wan come on board. ""If you look di profile of di aspirants a lot of dem get experience in leadership for different levels. ""E dey difficult to predict for politics but by and large APC delegates go look at a few factors. ""Di outgoing president Muhammadu Buhari get important role to play if you wan read my mind dat na wetin go happun. ""By di time dem reach Abuja and di president moderate e go dey clear wia di whole tin dey go."" As per prediction, di president don already give hint for interview wey im do wit tori pipo Channels e tok two tins E say di pesin wey go succeed am go be younger pesin. ""Di second tin wey e tok na say him no go name im successor,"" Sogbeye tok For me di president go play major role to determine who go pick di ticket and di direction of wia di delegates vote go go. Nigeria ruling party All Progressives Party (APC) don set dia presidential primaries for May 30-31. We go dey update dis tori wit more aspirants profiles as dem dey come out one by one to declare dia intention."	NIGERIA	https://www.bbc.com/pidgin/tori-61083547
2023 Election: List of affected ministers Buhari ask to resign for election ambition	"President Muhammadu Buhari don tell all im cabinet members wey wan contest di 2023 elections to resign. Di Nigerian leader give federal ministers until May 16, 2023, to quit and face dia political ambition. Information Minister, Lai Mohammed, confam di tori Wednesday afternoon for State House, Abuja. Buhari give di directive during di Federal Executive Council meeting wey im lead. Di only pesin wey di marching order no affect na di Vice President, Yemi Osinbajo wey also declare interest to contest presidential election. Nigeria electoral law require appointed goment officials to leave dia offices before participating in an election as candidates. E no dey yet clear wen di president go appoint di ministers wey go replace those affected. Plenti of Buhari cabinet ministers don already declare intentions to be dia party candidates. Dem be aspirants for either presidential or state govnorship elections wey dey hold next year. Chibuike Rotimi Amaechi - Minister of Transportation Godswill Akpabio - Minister of Niger Delta Affairs Ogbonnaya Onu - Minister of Labour and Employment Chris Ngige - Minister of Science and Technology Emeka Nwajiuba - Minister of State for Education Timipre Sylva - Minister of State, Petroleum Resources Uche Ogar - Minister of State, Mines and Steel Development Abubakar Malami - Minister of Justice and Attorney-General Paulline Tallen - Minister of Women Affairs Minister of State for Education, Emeka Nwajuiba resign on Wenesday from im post to pursue im presidential ambition, reports tok. Di move fit get an impact on di running of goment activities as e be say high number of ministers dey affected by di decision. However, President Buhari tok-tok pesin tell BBC say goment activities no go dey affected. All political parties dey expected to conduct dia primaries later dis month. Na for February President Muhammadu Buhari sign di electoral act 2022 into law. Section 84(12) na part of di Nigeria Electoral Act 2022. One of di clause wey dem newly introduce for di new electoral act na section 84(12) wey provide dat anyone wey hold political office - ministers commissioners, special advisers and odas - must give up di position before dem go fit dey qualify to participate for di electoral process either as candidate or as delegate. Section 84(12) of di electoral act 2022 provide say: ""No political appointee at any level go be voting delegate or be voted for during di convention or congress of any political party for di purpose of di nomination of candidates for any election"". Wetin dis mean be say, any pesin wey dey hold political appointment like ministers, commissioners, special advisers, personal assistants dem, weda dem dey serve for federal or state level no go fit vote and nobody go fit vote for am for primaries. Therefore, since nobody vote for am for primaries, e mean say im no be candidate for any election. Di only way pesin fit be candidate na to resign before di primaries."	NIGERIA	https://www.bbc.com/pidgin/tori-61412030
FG and ASUU strike update: Buhari beg Academic Staff Union of Universities to stop strike	"President Muhammadu Buhari don beg Nigeria public universities lecturers union - ASUU - to call off dia ongoing strike. Buhari ask di Academic Staff Union of Universities to consider di plight of students and stop dia industrial action. Di Nigerian leader make dis appeal on Thursday, 12 May, 2022, during di 19th National Productivity Day awards. E also advise students for Nigeria public tertiary institutions to exercise patience as di goment dey try to address di mata. Di president say goment dey look into di issues of di nation university system within di ambit of di resources wey dey available. Di move dey come one day afta polytechnic lecturers union declare to begin nationwide strike from Monday 15 May, 2022. President Buhari for one statement issue by im spokesman, Femi Adesina, recall say; E don earlier direct di Chief of Staff, Hon. Ministers of Labour and Employment, Education, Finance, Budget and National Planning to immediately bring all parties to di negotiation table. Di move na to again critically look at di grey areas for di demands of ASUU and in fact all oda University based labour unions. Di president pledge say di Federal Goment go continue to do everything possible to uplift di standard of di educational system for di kontri. E say im goment recognise say di future of any nation dey link to di standard of dia educational system. For February 14, 2022, ASUU bin begin strike sake of Federal Goment failure to honour di 2009 agreement. And wen di ASUU strike clock three months on Monday, di union announce extension by 12 weeks starting from 12: 01 am on Monday, May 9, 2022. ASUU presido, Emmanuel Asodeke wey announce di extension for dia secretariat for University of Abuja say; ""Afta extensive deliberations, noting Federal Goment failure to live up to dia responsibilities and speedily address di issues raised for di 2020 FG-ASUU Memorandum of Action, within di additional eight-week roll-over strike period declare on March 14, 2022, NEC don resolve to rolled-ova di strike for 12 Weeks to give goment more time to satisfactorily resolve all di outstanding issues."" Di roll-over strike na with effect from 12.01am on Monday, May 9, 2022,"" di Union communique tok. Many Nigerians plus students don so far react to di long strike by ASUU. Human rights activist Aisha Yesufu, Nigeria entrepreneur Dami Adenuga, human right activist and publisher, Omoyele Sowore and odas express dia opinion for social media. ASUU national president Prof Osodeke say di Union neva get any informate from any ministry of goment say meeting go happun. ""Dem no call us. We no go beg dem to meet wit us and we no go go to dem if dem no invite us,"" im tok. As dem no hear from di goment, dia National Executive Council meet dis week wey also be di last week of di two months rollover strike wey dem first begin some weeks back. For di Executive Council meeting dem decide to extend di strike for anoda three weeks, according to dem,na sake of di ""insincerity"" of di goment delegation. But di Ministry of Education fault ASUU claims. Tok tok pesin for di ministry Ben Goong say di negotiating team go meet di union dis week. ""Di negotiating team go meet ASUU dis week. I no fit tok wen but I dey very sure saydem go meeting. Di team don reach out to ASUU."" Oga Ben add say: ""No be true say we no dey communicate wit dem. ASUU dey make series of demands including salary increase. If we no dey commiunicate, who dem dey make dia demands to? On Friday, Nigeria Minister of Labour and Employment, Chris Ngige, during meeting wey im do wur di striking National Association of Academic Technologists, promise to meet wit ASUU dis week. Di Academic Staff Union of Universities, bin begin one month warning strike on February 14 2022 to demand for beta condition of service wey dem agree for 2009 agreement. 2020 ASUU Strike Di union bin embark on nine-month strike sake of non-payment of allowances to lecturers wey no enrol under di goment payroll system, wey ASUU bin want replace wit dia own. 2018 ASUU Strike One three-month strike bin happun sake of poor funding of education and increment of school fees wey goment bin plan. 2017 ASUU Strike After dem sign anoda MoU in September 2017, di union bin suspend dia 36-day strike wey bin happun sake of allegations say goment fail to implement agreement from previous year. 2014 ASUU Strike One week warning strike bin dey sake of say Nigerian goment no implement di 2009 agreement and one MoU wey dem reach for 2013. 2013 ASUU Strike University lecturers bin go on strike for about six months as dem demand say make retirement age for professor dey extended to 70 instead of 65, and make goment increase allocation to education from 15% - 20% of di kontri annual budget. 2011 ASUU Strike 2009 agreement wey goment no meet na why di union bin go on a 59-day strike. 2010 ASUU Strike ASUU bin go on indefinite strike in July 2010 wey last for over five months. 2009 ASUU Strike Four months strike sake of 2007 agreement wey goment no meet wey involve demand for increase of budgetary allocation to education in Nigeria."	NIGERIA	https://www.bbc.com/pidgin/world-61426866
AMVCA 2022: Time, how to watch plus wetin you need know about di award	Evritin don set for di 8th edition of di Africa Magic Viewers' Choice Awards (AMVCA) wey go shele on Saturday 14 May 2022. Di award, wey some pipo dey call di 'Africa version of Oscar', dey celebrate di work and talent of actors, producers, directors, and oda feem professionals. AMVCA dey make a comeback afta e no fit hold for 2021 sake of di Covid-19 pandemic. Di organisers announce 33 categories, and 12 among dem dey open to public voting. Di winner for di Best Soundtrack category go walk away with one million naira. Na di awards panel headed by seasoned feemmaker, Victor Okhai, go select di oda 21 categories. Dem introduce di Best Online Social Content Creator as new category. Dis category go feature social media content creators like Mr. Macaroni, Taaooma, Tee Kuro, Elozonam, Oga Sabinus and odas. Who go host di red carpet? Di organisers of di award tok say Toke Makinwa, Ebuka Obi-Uchendu, Uti Nwachukwu and Sika Osei na dem go be di Red Carpet hosts for di night. Na dis four pipo go interview pipo wey go attend di award and dem go catch all di fashion moments and predictions of di biggest wins for di night. Hollywood pipo go show face Di organisers of di award say dem go host celebrity movie stars and feem directors from Hollywood before di award ceremony. Na Tasha Smith go lead di visiting Hollywood stars. She be actress, director and producer wey dey known for her role for di ogbonge feem 'Why Did I Get Married?' and 'Why Did I Get Married, Too?'. Bayo Akinfemi wey be cast inside di popular television series, Bob Hearts Abishola , go join am. Brandon Michael Hall wey dey inside television series God, Friended Me go also show face. Award-winning producer Sidra Smith and director Grant Housley go also dey around. Di Hollywood stars go meet with di AMVCA nominees and oda industry stakeholders. Pipo wey dey live for Nigeria fit watch di show on All Africa Magic channels and Gotv at 16:00 WAT (17:00 CAT). Odas wey want also watch am but no dey house fit stream live on di DSTV App if dem get beta internet connection. Oda categories for di award Nigerians and oda Africans dey always anticipate di AMVCA sake of say nai be like di African version of di Oscar. Voting don already close for di categories wey dey open to di public. Many pipo don already vote dia favourite nominees and na Saturday, 14 May we go know who and who go go home wit different awards.	NIGERIA	https://www.bbc.com/pidgin/tori-61423580
